{
  "schema_version": "1.0",
  "updated": "2026-08-09",
  "note": "场景别名→光线条目映射表。供 retriever.py 别名层使用：分镜场景词命中 alias → targets 为 scene-light 条目 id → 直取条目。",
  "aliases": [
    {"alias": "美术馆", "category": "clothing", "targets": ["satin", "organza"], "note": "大理石美术馆/艺术画廊→缎面/欧根纱"},
    {"alias": "博物馆", "category": "clothing", "targets": ["satin"], "note": "大理石展陈空间→缎面"},
    {"alias": "画廊", "category": "clothing", "targets": ["organza", "satin"], "note": "艺术画廊→欧根纱/缎面"},
    {"alias": "酒店", "category": "clothing", "targets": ["satin", "fur"], "note": "酒店大堂→缎面；豪华酒店→皮草"},
    {"alias": "海边", "category": "clothing", "targets": ["chiffon", "linen", "crochet", "activewear"], "note": "海边→雪纺/亚麻/钩针/运动面料"},
    {"alias": "海滩", "category": "clothing", "targets": ["chiffon", "crochet", "linen"], "note": "海滩度假→雪纺/钩针/亚麻"},
    {"alias": "花园", "category": "clothing", "targets": ["chiffon", "lace"], "note": "花园/花园洋房→雪纺/蕾丝"},
    {"alias": "天台", "category": "clothing", "targets": ["chiffon", "techshell", "worsted"], "note": "天台→雪纺/冲锋衣/精纺西装"},
    {"alias": "街头", "category": "clothing", "targets": ["denim", "knit", "gabardine", "cotton"], "note": "城市街头→牛仔/针织/风衣面料/棉"},
    {"alias": "咖啡店", "category": "clothing", "targets": ["cotton", "cashmere"], "note": "咖啡馆/晨雾咖啡灯→棉/羊绒"},
    {"alias": "咖啡馆", "category": "clothing", "targets": ["cotton", "cashmere"], "note": "日常咖啡场景→棉/羊绒"},
    {"alias": "居家", "category": "clothing", "targets": ["cotton", "knit", "velvet2"], "note": "居家沙发→棉/针织；家居丝绒"},
    {"alias": "卧室", "category": "clothing", "targets": ["tencel"], "note": "晨光卧室→天丝"},
    {"alias": "雪景", "category": "clothing", "targets": ["wool", "fur", "down", "fleece"], "note": "雪景→羊毛/皮草/羽绒/摇粒绒"},
    {"alias": "滑雪", "category": "clothing", "targets": ["down", "fleece", "cashmere"], "note": "雪场/雪山缆车→羽绒/摇粒绒/羊绒"},
    {"alias": "派对", "category": "clothing", "targets": ["sequin"], "note": "派对空间→珠片亮片"},
    {"alias": "夜店", "category": "clothing", "targets": ["leather", "sequin"], "note": "夜店→皮革/珠片"},
    {"alias": "婚礼", "category": "clothing", "targets": ["lace", "tulle"], "note": "婚纱→蕾丝/网纱"},
    {"alias": "健身房", "category": "clothing", "targets": ["activewear"], "note": "健身房→瑜伽弹力面料"},
    {"alias": "泳池", "category": "clothing", "targets": ["crochet"], "note": "泳池边→镂空钩针"},
    {"alias": "复古剧院", "category": "clothing", "targets": ["velvet", "fur"], "note": "复古剧院→丝绒/皮草"},
    {"alias": "办公室", "category": "clothing", "targets": ["worsted"], "note": "摩天楼办公室→精纺西装面料"},
    {"alias": "金融街", "category": "clothing", "targets": ["worsted"], "note": "金融街→精纺西装面料"},
    {"alias": "雨夜", "category": "clothing", "targets": ["gabardine", "techshell"], "note": "雨夜街道→风衣面料；雨中山脊→冲锋衣"},
    {"alias": "机场", "category": "clothing", "targets": ["gabardine"], "note": "机场→风衣面料"},
    {"alias": "露营", "category": "clothing", "targets": ["fleece"], "note": "露营灯下→摇粒绒"},
    {"alias": "雪山", "category": "clothing", "targets": ["cashmere", "down"], "note": "雪山缆车→羊绒/羽绒"},
    {"alias": "夜跑", "category": "clothing", "targets": ["reflective"], "note": "夜间街道→反光面料"},
    {"alias": "城市夜景", "category": "clothing", "targets": ["reflective", "sequin"], "note": "城市夜景/夜景霓虹→反光面料/珠片"},
    {"alias": "茶室", "category": "clothing", "targets": ["silk", "cottonlinen"], "note": "茶室→丝绸/棉麻"},
    {"alias": "中式庭院", "category": "clothing", "targets": ["silk", "cottonlinen"], "note": "中式/禅意庭院→丝绸/棉麻"},
    {"alias": "舞台", "category": "clothing", "targets": ["tulle", "sequin"], "note": "舞台→网纱/珠片"},
    {"alias": "机车", "category": "clothing", "targets": ["leather", "denim"], "note": "机车俱乐部/车库→皮革/牛仔"},
    {"alias": "壁炉", "category": "clothing", "targets": ["wool", "velvet2"], "note": "壁炉边→羊毛/天鹅绒"},
    {"alias": "英伦街道", "category": "clothing", "targets": ["tweed"], "note": "英伦街道→粗花呢"},
    {"alias": "秋日公园", "category": "clothing", "targets": ["corduroy", "tweed"], "note": "秋日公园长椅/枫林→灯芯绒/粗花呢"},
    {"alias": "书店", "category": "clothing", "targets": ["knit", "corduroy"], "note": "书店/复古书店→针织/灯芯绒"},
    {"alias": "户外", "category": "clothing", "targets": ["fleece", "techshell", "quickdry"], "note": "户外山野→摇粒绒/冲锋衣/速干"},
    {"alias": "梳妆台", "category": "beauty", "targets": ["lipstick", "eyeshadow", "serum", "tool"], "note": "梳妆台镜前→口红/眼影/精华/化妆刷"},
    {"alias": "化妆台", "category": "beauty", "targets": ["foundation", "tool", "eyeshadow"], "note": "化妆台→粉底/化妆刷/眼影"},
    {"alias": "化妆镜前", "category": "beauty", "targets": ["lipstick", "eyeliner"], "note": "化妆镜前特写→口红/眼线"},
    {"alias": "浴室", "category": "beauty", "targets": ["foundation", "serum", "cleanser", "bodylotion", "menscare", "eyeliner"], "note": "浴室→粉底/精华/洁面/身体乳/男士护肤/眼线"},
    {"alias": "晨光卧室", "category": "beauty", "targets": ["foundation", "serum", "bodylotion", "perfume"], "note": "晨光卧室→粉底/精华/身体乳/香水"},
    {"alias": "睡前", "category": "beauty", "targets": ["mask"], "note": "睡前卧室→面膜"},
    {"alias": "浴缸", "category": "beauty", "targets": ["mask"], "note": "浴缸→面膜"},
    {"alias": "都市夜景", "category": "beauty", "targets": ["lipstick"], "note": "都市夜景→口红"},
    {"alias": "试色", "category": "beauty", "targets": ["lipstick"], "note": "试色特写→口红"},
    {"alias": "舞台后台", "category": "beauty", "targets": ["eyeshadow"], "note": "舞台后台→眼影"},
    {"alias": "花园", "category": "beauty", "targets": ["blush"], "note": "花园→腮红/高光"},
    {"alias": "夏日海边", "category": "beauty", "targets": ["nail", "sunscreen"], "note": "夏日海边→指甲油/防晒"},
    {"alias": "美甲", "category": "beauty", "targets": ["nail"], "note": "美甲台→指甲油"},
    {"alias": "海边", "category": "beauty", "targets": ["sunscreen"], "note": "海边→防晒"},
    {"alias": "健身房", "category": "beauty", "targets": ["menscare"], "note": "健身房→男士护肤"},
    {"alias": "通勤晨间", "category": "beauty", "targets": ["eyeliner"], "note": "通勤晨间→眼线"},
    {"alias": "法式公寓", "category": "beauty", "targets": ["perfume"], "note": "法式公寓→香水"},
    {"alias": "花丛", "category": "beauty", "targets": ["perfume"], "note": "花丛→香水"},
    {"alias": "礼物", "category": "beauty", "targets": ["perfume", "giftbox"], "note": "礼物场景→香水/彩妆礼盒"},
    {"alias": "节日", "category": "beauty", "targets": ["giftbox"], "note": "节日氛围→彩妆礼盒"},
    {"alias": "极简桌面", "category": "beauty", "targets": ["tool"], "note": "极简桌面→美妆工具"},
    {"alias": "早餐", "category": "food", "targets": ["baking", "juice", "dairy"], "note": "早餐桌→烘焙/果汁/乳制品"},
    {"alias": "晨光早餐", "category": "food", "targets": ["dairy", "baking"], "note": "晨光早餐桌→乳制品/烘焙"},
    {"alias": "面包店", "category": "food", "targets": ["baking"], "note": "午后阳光面包店→烘焙面包"},
    {"alias": "餐厅", "category": "food", "targets": ["hotpot"], "note": "餐厅餐桌→火锅/汤类"},
    {"alias": "深夜食堂", "category": "food", "targets": ["hotpot", "noodle"], "note": "深夜食堂→火锅/面条"},
    {"alias": "夜市", "category": "food", "targets": ["bbq"], "note": "夜市→烧烤"},
    {"alias": "户外烧烤", "category": "food", "targets": ["bbq"], "note": "户外烧烤→烧烤/烤肉"},
    {"alias": "面馆", "category": "food", "targets": ["noodle"], "note": "面馆→面条/粉面"},
    {"alias": "家庭餐桌", "category": "food", "targets": ["noodle"], "note": "家庭餐桌→面条"},
    {"alias": "办公室", "category": "food", "targets": ["instant", "coffee"], "note": "办公室→速食/咖啡"},
    {"alias": "居家", "category": "food", "targets": ["instant", "snack"], "note": "居家→速食/零食"},
    {"alias": "甜品店", "category": "food", "targets": ["dessert", "icecream"], "note": "甜品店→甜品/冰淇淋"},
    {"alias": "下午茶", "category": "food", "targets": ["dessert"], "note": "下午茶→甜品/蛋糕"},
    {"alias": "咖啡馆", "category": "food", "targets": ["coffee"], "note": "咖啡馆→咖啡/茶饮"},
    {"alias": "泳池边", "category": "food", "targets": ["juice"], "note": "泳池边→果汁/饮品"},
    {"alias": "夏日街头", "category": "food", "targets": ["icecream"], "note": "夏日街头→冰淇淋/雪糕"},
    {"alias": "野餐", "category": "food", "targets": ["snack"], "note": "野餐→零食"},
    {"alias": "厨房", "category": "food", "targets": ["sauce", "fruit", "babyfood", "dairy"], "note": "厨房→酱料/水果/辅食/乳制品"},
    {"alias": "市场", "category": "food", "targets": ["fruit"], "note": "市场→水果生鲜"},
    {"alias": "酒吧", "category": "food", "targets": ["wine"], "note": "酒吧→酒类"},
    {"alias": "烛光餐桌", "category": "food", "targets": ["wine"], "note": "烛光餐桌→酒类"},
    {"alias": "宝宝餐椅", "category": "food", "targets": ["babyfood"], "note": "宝宝餐椅→婴幼儿辅食"}
  ]
}
